
SQL*Plus: Release 18.0.0.0.0 - Production on Lun. FÚvr. 8 09:55:53 2021
Version 18.4.0.0.0

Copyright (c) 1982, 2018, Oracle.  All rights reserved.

Heure de la derniÞre connexion rÚussie : Lun. FÚvr. 08 2021 09:37:28 +01:00

ConnectÚ Ó :
Oracle Database 18c Express Edition Release 18.0.0.0.0 - Production
Version 18.4.0.0.0

SQL> select * from cat;

TABLE_NAME
--------------------------------------------------------------------------------
TABLE_TYPE
-----------
t1
TABLE

T2
TABLE

CLIENT
TABLE


TABLE_NAME
--------------------------------------------------------------------------------
TABLE_TYPE
-----------
COMPTE
TABLE

PRET
TABLE


SQL> select * from client;

  NOCLIENT NOMCLIENT          ADRESSECLIENT        NOTELEPHONE
---------- ------------------ -------------------- ---------------
        10 Luc Sansom         Ottawa               (999)999-9999
        20 Dollard Tremblay   MontrÚal             (888)888-8888
        30 Lin B¶             MontrÚal             (777)777-7777

SQL> desc pret
 Nom                                       NULL ?   Type
 ----------------------------------------- -------- ----------------------------
 NOPRET                                    NOT NULL NUMBER(38)
 MONTANTPRET                                        NUMBER(10,2)
 DATEDEBUT                                          DATE
 TAUXINTERET                                        NUMBER(8,2)
 FREQUENCEPAIEMENT                                  NUMBER(38)
 NOCLIENT                                           NUMBER(38)

SQL> desc compte
 Nom                                       NULL ?   Type
 ----------------------------------------- -------- ----------------------------
 NOCOMPTE                                  NOT NULL NUMBER(38)
 SOLDE                                              NUMBER(10,2)
 DATEOUVERTURE                                      DATE
 NOCLIENT                                           NUMBER(38)

SQL> select * from compte
  2  ;

  NOCOMPTE      SOLDE DATEOUVE   NOCLIENT
---------- ---------- -------- ----------
       100       1000 05/05/99         10
       200       2000 10/10/99         20
       300       1000 10/10/99         10
       400          5 20/07/00         30
       600         10 15/10/00         30

SQL> update compte set solde= solde+100 where nocompte=100;

1 ligne mise Ó jour.

SQL> select * from compte;

  NOCOMPTE      SOLDE DATEOUVE   NOCLIENT
---------- ---------- -------- ----------
       100       1100 05/05/99         10
       200       2000 10/10/99         20
       300       1000 10/10/99         10
       400          5 20/07/00         30
       600         10 15/10/00         30

SQL> commit;

Validation effectuÚe.

SQL> select * from compte;

  NOCOMPTE      SOLDE DATEOUVE   NOCLIENT
---------- ---------- -------- ----------
       100       1100 05/05/99         10
       200       2000 10/10/99         20
       300       1000 10/10/99         10
       400          5 20/07/00         30
       600         10 15/10/00         30

SQL>